book;chapter,verse,text
2-corinthians;7;9;νυν χαιρω ουχ οτι ελυπηθητε αλλ οτι ελυπηθητε εις μετανοιαν ελυπηθητε γαρ κατα θεον ινα εν μηδενι ζημιωθητε εξ ημων
2-corinthians;7;10;η γαρ κατα θεον λυπη μετανοιαν εις σωτηριαν αμεταμελητον κατεργαζεται η δε του κοσμου λυπη θανατον κατεργαζεται
2-corinthians;7;11;ιδου γαρ αυτο τουτο το κατα θεον λυπηθηναι υμας ποσην κατειργασατο υμιν σπουδην αλλα απολογιαν αλλα αγανακτησιν αλλα φοβον αλλα επιποθησιν αλλα ζηλον αλλ εκδικησιν εν παντι συνεστησατε εαυτους αγνους ειναι εν τω πραγματι
2-corinthians;7;12;αρα ει και εγραψα υμιν ουχ εινεκεν του αδικησαντος ουδε εινεκεν του αδικηθεντος αλλ εινεκεν του φανερωθηναι την σπουδην την υπερ προς υμας ενωπιον του θεου
2-corinthians;7;13;δια τουτο παρακεκλημεθα επι τη παρακλησει υμων περισσοτερως δε μαλλον εχαρημεν επι τη χαρα τιτου οτι αναπεπαυται το πνευμα αυτου απο παντων υμων
2-corinthians;7;14;οτι ει τι αυτω υπερ υμων κεκαυχημαι ου κατησχυνθην αλλ ως παντα εν αληθεια ελαλησαμεν υμιν ουτως και η καυχησις ημων η επι τιτου αληθεια εγενηθη
2-corinthians;7;15;και τα σπλαγχνα αυτου περισσοτερως εις υμας εστιν αναμιμνησκομενου την παντων υμων υπακοην ως μετα φοβου και τρομου εδεξασθε αυτον
2-corinthians;7;16;χαιρω οτι εν παντι θαρρω εν υμιν
2-corinthians;8;1;γνωριζομεν δε υμιν αδελφοι την χαριν του θεου την δεδομενην εν ταις εκκλησιαις της μακεδονιας
2-corinthians;8;2;οτι εν πολλη δοκιμη θλιψεως η περισσεια της χαρας αυτων και η κατα βαθους πτωχεια αυτων επερισσευσεν εις τον πλουτον της απλοτητος αυτων
2-corinthians;8;3;οτι κατα δυναμιν μαρτυρω και υπερ δυναμιν αυθαιρετοι
2-corinthians;8;4;μετα πολλης παρακλησεως δεομενοι ημων την χαριν και την κοινωνιαν της διακονιας της εις τους αγιους δεξασθαι ημας
2-corinthians;8;5;και ου καθως ηλπισαμεν αλλ εαυτους εδωκαν πρωτον τω κυριω και ημιν δια θεληματος θεου
2-corinthians;8;6;εις το παρακαλεσαι ημας τιτον ινα καθως προενηρξατο ουτως και επιτελεση εις υμας και την χαριν ταυτην
2-corinthians;8;7;αλλ ωσπερ εν παντι περισσευετε πιστει και λογω και γνωσει και παση σπουδη και τη εξ υμων εν ημιν αγαπη ινα και εν ταυτη τη χαριτι περισσευητε
2-corinthians;8;8;ου κατ επιταγην λεγω αλλα δια της ετερων σπουδης και το της υμετερας αγαπης γνησιον δοκιμαζων
2-corinthians;8;9;γινωσκετε γαρ την χαριν του κυριου ημων ιησου χριστου οτι δι υμας επτωχευσεν πλουσιος ων ινα υμεις τη εκεινου πτωχεια πλουτησητε
2-corinthians;8;10;και γνωμην εν τουτω διδωμι τουτο γαρ υμιν συμφερει οιτινες ου μονον το ποιησαι αλλα και το θελειν προενηρξασθε απο περυσι
2-corinthians;8;11;νυνι δε και το ποιησαι επιτελεσατε οπως καθαπερ η προθυμια του θελειν ουτως και το επιτελεσαι εκ του εχειν
2-corinthians;8;12;ει γαρ η προθυμια προκειται καθο εαν εχη τις ευπροσδεκτος ου καθο ουκ εχει
2-corinthians;8;13;ου γαρ ινα αλλοις ανεσις υμιν δε θλιψις αλλ εξ ισοτητος εν τω νυν καιρω το υμων περισσευμα εις το εκεινων υστερημα
2-corinthians;8;14;ινα και το εκεινων περισσευμα γενηται εις το υμων υστερημα οπως γενηται ισοτης
2-corinthians;8;15;καθως γεγραπται ο το πολυ ουκ επλεονασεν και ο το ολιγον ουκ ηλαττονησεν
2-corinthians;8;16;χαρις δε τω θεω τω διδοντι την αυτην σπουδην υπερ υμων εν τη καρδια τιτου
2-corinthians;8;17;οτι την μεν παρακλησιν εδεξατο σπουδαιοτερος δε υπαρχων αυθαιρετος εξηλθεν προς υμας
2-corinthians;8;18;συνεπεμψαμεν δε μετ αυτου τον αδελφον ου ο επαινος εν τω ευαγγελιω δια πασων των εκκλησιων
2-corinthians;8;19;ου μονον δε αλλα και χειροτονηθεις υπο των εκκλησιων συνεκδημος ημων συν τη χαριτι ταυτη τη διακονουμενη υφ ημων προς την αυτου του κυριου δοξαν και προθυμιαν υμων
2-corinthians;8;20;στελλομενοι τουτο μη τις ημας μωμησηται εν τη αδροτητι ταυτη τη διακονουμενη υφ ημων
2-corinthians;8;21;προνοουμενοι καλα ου μονον ενωπιον κυριου αλλα και ενωπιον ανθρωπων
2-corinthians;8;22;συνεπεμψαμεν δε αυτοις τον αδελφον ημων ον εδοκιμασαμεν εν πολλοις πολλακις σπουδαιον οντα νυνι δε πολυ σπουδαιοτερον πεποιθησει πολλη τη εις υμας
2-corinthians;8;23;ειτε υπερ τιτου κοινωνος εμος και εις υμας συνεργος ειτε αδελφοι ημων αποστολοι εκκλησιων δοξα χριστου
2-corinthians;8;24;την ουν ενδειξιν της αγαπης υμων και ημων καυχησεως υπερ υμων εις αυτους ενδειξασθε και εις προσωπον των εκκλησιων
2-corinthians;9;1;περι μεν γαρ της διακονιας της εις τους αγιους περισσον μοι εστιν το γραφειν υμιν
2-corinthians;9;2;οιδα γαρ την προθυμιαν υμων ην υπερ υμων καυχωμαι μακεδοσιν οτι αχαια παρεσκευασται απο περυσι και ο εξ υμων ζηλος ηρεθισεν τους πλειονας
2-corinthians;9;3;επεμψα δε τους αδελφους ινα μη το καυχημα ημων το υπερ υμων κενωθη εν τω μερει τουτω ινα καθως ελεγον παρεσκευασμενοι ητε
2-corinthians;9;4;μηπως εαν ελθωσιν συν εμοι μακεδονες και ευρωσιν υμας απαρασκευαστους καταισχυνθωμεν ημεις ινα μη λεγωμεν υμεις εν τη υποστασει ταυτη της καυχησεως
2-corinthians;9;5;αναγκαιον ουν ηγησαμην παρακαλεσαι τους αδελφους ινα προελθωσιν εις υμας και προκαταρτισωσιν την προκατηγγελμενην ευλογιαν υμων ταυτην ετοιμην ειναι ουτως ως ευλογιαν και μη ωσπερ πλεονεξιαν
2-corinthians;9;6;τουτο δε ο σπειρων φειδομενως φειδομενως και θερισει και ο σπειρων επ ευλογιαις επ ευλογιαις και θερισει
2-corinthians;9;7;εκαστος καθως προαιρειται τη καρδια μη εκ λυπης η εξ αναγκης ιλαρον γαρ δοτην αγαπα ο θεος
2-corinthians;9;8;δυνατος δε ο θεος πασαν χαριν περισσευσαι εις υμας ινα εν παντι παντοτε πασαν αυταρκειαν εχοντες περισσευητε εις παν εργον αγαθον
2-corinthians;9;9;καθως γεγραπται εσκορπισεν εδωκεν τοις πενησιν η δικαιοσυνη αυτου μενει εις τον αιωνα
2-corinthians;9;10;ο δε επιχορηγων σπερμα τω σπειροντι και αρτον εις βρωσιν χορηγησαι και πληθυναι τον σπορον υμων και αυξησαι τα γεννηματα της δικαιοσυνης υμων
2-corinthians;9;11;εν παντι πλουτιζομενοι εις πασαν απλοτητα ητις κατεργαζεται δι ημων ευχαριστιαν τω θεω
2-corinthians;9;12;οτι η διακονια της λειτουργιας ταυτης ου μονον εστιν προσαναπληρουσα τα υστερηματα των αγιων αλλα και περισσευουσα δια πολλων ευχαριστιων τω θεω
2-corinthians;9;13;δια της δοκιμης της διακονιας ταυτης δοξαζοντες τον θεον επι τη υποταγη της ομολογιας υμων εις το ευαγγελιον του χριστου και απλοτητι της κοινωνιας εις αυτους και εις παντας
2-corinthians;9;14;και αυτων δεησει υπερ υμων επιποθουντων υμας δια την υπερβαλλουσαν χαριν του θεου εφ υμιν
2-corinthians;9;15;χαρις δε τω θεω επι τη ανεκδιηγητω αυτου δωρεα
2-corinthians;10;1;αυτος δε εγω παυλος παρακαλω υμας δια της πραοτητος και επιεικειας του χριστου ος κατα προσωπον μεν ταπεινος εν υμιν απων δε θαρρω εις υμας
2-corinthians;10;2;δεομαι δε το μη παρων θαρρησαι τη πεποιθησει η λογιζομαι τολμησαι επι τινας τους λογιζομενους ημας ως κατα σαρκα περιπατουντας
2-corinthians;10;3;εν σαρκι γαρ περιπατουντες ου κατα σαρκα στρατευομεθα
2-corinthians;10;4;τα γαρ οπλα της στρατειας ημων ου σαρκικα αλλα δυνατα τω θεω προς καθαιρεσιν οχυρωματων
2-corinthians;10;5;λογισμους καθαιρουντες και παν υψωμα επαιρομενον κατα της γνωσεως του θεου και αιχμαλωτιζοντες παν νοημα εις την υπακοην του χριστου
2-corinthians;10;6;και εν ετοιμω εχοντες εκδικησαι πασαν παρακοην οταν πληρωθη υμων η υπακοη
2-corinthians;10;7;τα κατα προσωπον βλεπετε ει τις πεποιθεν εαυτω χριστου ειναι τουτο λογιζεσθω παλιν αφ εαυτου οτι καθως αυτος χριστου ουτως και ημεις χριστου
2-corinthians;10;8;εαν τε γαρ και περισσοτερον τι καυχησωμαι περι της εξουσιας ημων ης εδωκεν ο κυριος ημιν εις οικοδομην και ουκ εις καθαιρεσιν υμων ουκ αισχυνθησομαι
2-corinthians;10;9;ινα μη δοξω ως αν εκφοβειν υμας δια των επιστολων
2-corinthians;10;10;οτι αι μεν επιστολαι φησιν βαρειαι και ισχυραι η δε παρουσια του σωματος ασθενης και ο λογος εξουθενημενος
2-corinthians;10;11;τουτο λογιζεσθω ο τοιουτος οτι οιοι εσμεν τω λογω δι επιστολων αποντες τοιουτοι και παροντες τω εργω
2-corinthians;10;12;ου γαρ τολμωμεν εγκριναι η συγκριναι εαυτους τισιν των εαυτους συνιστανοντων αλλα αυτοι εν εαυτοις εαυτους μετρουντες και συγκρινοντες εαυτους εαυτοις ου συνιουσιν
2-corinthians;10;13;ημεις δε ουχι εις τα αμετρα καυχησομεθα αλλα κατα το μετρον του κανονος ου εμερισεν ημιν ο θεος μετρου εφικεσθαι αχρι και υμων
2-corinthians;10;14;ου γαρ ως μη εφικνουμενοι εις υμας υπερεκτεινομεν εαυτους αχρι γαρ και υμων εφθασαμεν εν τω ευαγγελιω του χριστου
2-corinthians;10;15;ουκ εις τα αμετρα καυχωμενοι εν αλλοτριοις κοποις ελπιδα δε εχοντες αυξανομενης της πιστεως υμων εν υμιν μεγαλυνθηναι κατα τον κανονα ημων εις περισσειαν
2-corinthians;10;16;εις τα υπερεκεινα υμων ευαγγελισασθαι ουκ εν αλλοτριω κανονι εις τα ετοιμα καυχησασθαι
2-corinthians;10;17;ο δε καυχωμενος εν κυριω καυχασθω
2-corinthians;10;18;ου γαρ ο εαυτον συνιστων εκεινος εστιν δοκιμος αλλ ον ο κυριος συνιστησιν
2-corinthians;11;1;οφελον ανειχεσθε μου μικρον τη αφροσυνη αλλα και ανεχεσθε μου
2-corinthians;11;2;ζηλω γαρ υμας θεου ζηλω ηρμοσαμην γαρ υμας ενι ανδρι παρθενον αγνην παραστησαι τω χριστω
2-corinthians;11;3;φοβουμαι δε μηπως ως ο οφις ευαν εξηπατησεν εν τη πανουργια αυτου ουτως φθαρη τα νοηματα υμων απο της απλοτητος της εις τον χριστον
2-corinthians;11;4;ει μεν γαρ ο ερχομενος αλλον ιησουν κηρυσσει ον ουκ εκηρυξαμεν η πνευμα ετερον λαμβανετε ο ουκ ελαβετε η ευαγγελιον ετερον ο ουκ εδεξασθε καλως ηνειχεσθε
2-corinthians;11;5;λογιζομαι γαρ μηδεν υστερηκεναι των υπερ λιαν αποστολων
2-corinthians;11;6;ει δε και ιδιωτης τω λογω αλλ ου τη γνωσει αλλ εν παντι φανερωθεντες εν πασιν εις υμας
2-corinthians;11;7;η αμαρτιαν εποιησα εμαυτον ταπεινων ινα υμεις υψωθητε οτι δωρεαν το του θεου ευαγγελιον ευηγγελισαμην υμιν
2-corinthians;11;8;αλλας εκκλησιας εσυλησα λαβων οψωνιον προς την υμων διακονιαν
2-corinthians;11;9;και παρων προς υμας και υστερηθεις ου κατεναρκησα ουδενος το γαρ υστερημα μου προσανεπληρωσαν οι αδελφοι ελθοντες απο μακεδονιας και εν παντι αβαρη υμιν εμαυτον ετηρησα και τηρησω
2-corinthians;11;10;εστιν αληθεια χριστου εν εμοι οτι η καυχησις αυτη ου εις εμε εν τοις κλιμασιν της αχαιας
2-corinthians;11;11;δια τι οτι ουκ αγαπω υμας ο θεος οιδεν
2-corinthians;11;12;ο δε ποιω και ποιησω ινα εκκοψω την αφορμην των θελοντων αφορμην ινα εν ω καυχωνται ευρεθωσιν καθως και ημεις
2-corinthians;11;13;οι γαρ τοιουτοι ψευδαποστολοι εργαται δολιοι μετασχηματιζομενοι εις αποστολους χριστου
2-corinthians;11;14;και ου θαυμαστον αυτος γαρ ο σατανας μετασχηματιζεται εις αγγελον φωτος
2-corinthians;11;15;ου μεγα ουν ει και οι διακονοι αυτου μετασχηματιζονται ως διακονοι δικαιοσυνης ων το τελος εσται κατα τα εργα αυτων
2-corinthians;11;16;παλιν λεγω μη τις με δοξη αφρονα ειναι ει δε μηγε καν ως αφρονα δεξασθε με ινα μικρον τι καγω καυχησωμαι
2-corinthians;11;17;ο λαλω ου λαλω κατα κυριον αλλ ως εν αφροσυνη εν ταυτη τη υποστασει της καυχησεως
2-corinthians;11;18;επει πολλοι καυχωνται κατα την σαρκα καγω καυχησομαι
2-corinthians;11;19;ηδεως γαρ ανεχεσθε των αφρονων φρονιμοι οντες
2-corinthians;11;20;ανεχεσθε γαρ ει τις υμας καταδουλοι ει τις κατεσθιει ει τις λαμβανει ει τις επαιρεται ει τις υμας εις προσωπον δερει
2-corinthians;11;21;κατα ατιμιαν λεγω ως οτι ημεις ησθενησαμεν εν ω δ αν τις τολμα εν αφροσυνη λεγω τολμω καγω
2-corinthians;11;22;εβραιοι εισιν καγω ισραηλιται εισιν καγω σπερμα αβρααμ εισιν καγω
2-corinthians;11;23;διακονοι χριστου εισιν παραφρονων λαλω υπερ εγω εν κοποις περισσοτερως εν πληγαις υπερβαλλοντως εν φυλακαις περισσοτερως εν θανατοις πολλακις
2-corinthians;11;24;υπο ιουδαιων πεντακις τεσσαρακοντα παρα μιαν ελαβον
2-corinthians;11;25;τρις ερραβδισθην απαξ ελιθασθην τρις εναυαγησα νυχθημερον εν τω βυθω πεποιηκα
2-corinthians;11;26;οδοιποριαις πολλακις κινδυνοις ποταμων κινδυνοις ληστων κινδυνοις εκ γενους κινδυνοις εξ εθνων κινδυνοις εν πολει κινδυνοις εν ερημια κινδυνοις εν θαλασση κινδυνοις εν ψευδαδελφοις
2-corinthians;11;27;εν κοπω και μοχθω εν αγρυπνιαις πολλακις εν λιμω και διψει εν νηστειαις πολλακις εν ψυχει και γυμνοτητι
2-corinthians;11;28;χωρις των παρεκτος η επισυστασις μου η καθ ημεραν η μεριμνα πασων των εκκλησιων
2-corinthians;11;29;τις ασθενει και ουκ ασθενω τις σκανδαλιζεται και ουκ εγω πυρουμαι
2-corinthians;11;30;ει καυχασθαι δει τα της ασθενειας μου καυχησομαι
2-corinthians;11;31;ο θεος και πατηρ του κυριου ημων ιησου χριστου οιδεν ο ων ευλογητος εις τους αιωνας οτι ου ψευδομαι
2-corinthians;11;32;εν δαμασκω ο εθναρχης αρετα του βασιλεως εφρουρει την δαμασκηνων πολιν πιασαι με θελων
2-corinthians;11;33;και δια θυριδος εν σαργανη εχαλασθην δια του τειχους και εξεφυγον τας χειρας αυτου
2-corinthians;12;1;καυχασθαι δη ου συμφερει μοι ελευσομαι γαρ εις οπτασιας και αποκαλυψεις κυριου
2-corinthians;12;2;οιδα ανθρωπον εν χριστω προ ετων δεκατεσσαρων ειτε εν σωματι ουκ οιδα ειτε εκτος του σωματος ουκ οιδα ο θεος οιδεν αρπαγεντα τον τοιουτον εως τριτου ουρανου
2-corinthians;12;3;και οιδα τον τοιουτον ανθρωπον ειτε εν σωματι ειτε εκτος του σωματος ουκ οιδα ο θεος οιδεν
2-corinthians;12;4;οτι ηρπαγη εις τον παραδεισον και ηκουσεν αρρητα ρηματα α ουκ εξον ανθρωπω λαλησαι
2-corinthians;12;5;υπερ του τοιουτου καυχησομαι υπερ δε εμαυτου ου καυχησομαι ει μη εν ταις ασθενειαις μου
2-corinthians;12;6;εαν γαρ θελησω καυχησασθαι ουκ εσομαι αφρων αληθειαν γαρ ερω φειδομαι δε μη τις εις εμε λογισηται υπερ ο βλεπει με η ακουει τι εξ εμου
2-corinthians;12;7;και τη υπερβολη των αποκαλυψεων ινα μη υπεραιρωμαι εδοθη μοι σκολοψ τη σαρκι αγγελος σαταν ινα με κολαφιζη ινα μη υπεραιρωμαι
2-corinthians;12;8;υπερ τουτου τρις τον κυριον παρεκαλεσα ινα αποστη απ εμου
2-corinthians;12;9;και ειρηκεν μοι αρκει σοι η χαρις μου η γαρ δυναμις μου εν ασθενεια τελειουται ηδιστα ουν μαλλον καυχησομαι εν ταις ασθενειαις μου ινα επισκηνωση επ εμε η δυναμις του χριστου
2-corinthians;12;10;διο ευδοκω εν ασθενειαις εν υβρεσιν εν αναγκαις εν διωγμοις εν στενοχωριαις υπερ χριστου οταν γαρ ασθενω τοτε δυνατος ειμι
2-corinthians;12;11;γεγονα αφρων καυχωμενος υμεις με ηναγκασατε εγω γαρ ωφειλον υφ υμων συνιστασθαι ουδεν γαρ υστερησα των υπερ λιαν αποστολων ει και ουδεν ειμι
2-corinthians;12;12;τα μεν σημεια του αποστολου κατειργασθη εν υμιν εν παση υπομονη εν σημειοις και τερασιν και δυναμεσιν
2-corinthians;12;13;τι γαρ εστιν ο ηττηθητε υπερ τας λοιπας εκκλησιας ει μη οτι αυτος εγω ου κατεναρκησα υμων χαρισασθε μοι την αδικιαν ταυτην
2-corinthians;12;14;ιδου τριτον ετοιμως εχω ελθειν προς υμας και ου καταναρκησω υμων ου γαρ ζητω τα υμων αλλ υμας ου γαρ οφειλει τα τεκνα τοις γονευσιν θησαυριζειν αλλ οι γονεις τοις τεκνοις
2-corinthians;12;15;εγω δε ηδιστα δαπανησω και εκδαπανηθησομαι υπερ των ψυχων υμων ει και περισσοτερως υμας αγαπων ηττον αγαπωμαι
2-corinthians;12;16;εστω δε εγω ου κατεβαρησα υμας αλλ υπαρχων πανουργος δολω υμας ελαβον
2-corinthians;12;17;μη τινα ων απεσταλκα προς υμας δι αυτου επλεονεκτησα υμας
2-corinthians;12;18;παρεκαλεσα τιτον και συναπεστειλα τον αδελφον μη τι επλεονεκτησεν υμας τιτος ου τω αυτω πνευματι περιεπατησαμεν ου τοις αυτοις ιχνεσιν
2-corinthians;12;19;παλιν δοκειτε οτι υμιν απολογουμεθα κατενωπιον του θεου εν χριστω λαλουμεν τα δε παντα αγαπητοι υπερ της υμων οικοδομης
2-corinthians;12;20;φοβουμαι γαρ μηπως ελθων ουχ οιους θελω ευρω υμας καγω ευρεθω υμιν οιον ου θελετε μηπως ερεις ζηλοι θυμοι εριθειαι καταλαλιαι ψιθυρισμοι φυσιωσεις ακαταστασιαι
2-corinthians;12;21;μη παλιν ελθοντα με ταπεινωση ο θεος μου προς υμας και πενθησω πολλους των προημαρτηκοτων και μη μετανοησαντων επι τη ακαθαρσια και πορνεια και ασελγεια η επραξαν
2-corinthians;13;1;τριτον τουτο ερχομαι προς υμας επι στοματος δυο μαρτυρων και τριων σταθησεται παν ρημα
