book;chapter,verse,text
2-corinthians;13;2;προειρηκα και προλεγω ως παρων το δευτερον και απων νυν γραφω τοις προημαρτηκοσιν και τοις λοιποις πασιν οτι εαν ελθω εις το παλιν ου φεισομαι
2-corinthians;13;3;επει δοκιμην ζητειτε του εν εμοι λαλουντος χριστου ος εις υμας ουκ ασθενει αλλα δυνατει εν υμιν
2-corinthians;13;4;και γαρ ει εσταυρωθη εξ ασθενειας αλλα ζη εκ δυναμεως θεου και γαρ ημεις ασθενουμεν εν αυτω αλλα ζησομεθα συν αυτω εκ δυναμεως θεου εις υμας
2-corinthians;13;5;εαυτους πειραζετε ει εστε εν τη πιστει εαυτους δοκιμαζετε η ουκ επιγινωσκετε εαυτους οτι ιησους χριστος εν υμιν εστιν ει μη τι αδοκιμοι εστε
2-corinthians;13;6;ελπιζω δε οτι γνωσεσθε οτι ημεις ουκ εσμεν αδοκιμοι
2-corinthians;13;7;ευχομαι δε προς τον θεον μη ποιησαι υμας κακον μηδεν ουχ ινα ημεις δοκιμοι φανωμεν αλλ ινα υμεις το καλον ποιητε ημεις δε ως αδοκιμοι ωμεν
2-corinthians;13;8;ου γαρ δυναμεθα τι κατα της αληθειας αλλ υπερ της αληθειας
2-corinthians;13;9;χαιρομεν γαρ οταν ημεις ασθενωμεν υμεις δε δυνατοι ητε τουτο δε και ευχομεθα την υμων καταρτισιν
2-corinthians;13;10;δια τουτο ταυτα απων γραφω ινα παρων μη αποτομως χρησωμαι κατα την εξουσιαν ην εδωκεν μοι ο κυριος εις οικοδομην και ουκ εις καθαιρεσιν
2-corinthians;13;11;λοιπον αδελφοι χαιρετε καταρτιζεσθε παρακαλεισθε το αυτο φρονειτε ειρηνευετε και ο θεος της αγαπης και ειρηνης εσται μεθ υμων
2-corinthians;13;12;ασπασασθε αλληλους εν αγιω φιληματι ασπαζονται υμας οι αγιοι παντες
2-corinthians;13;13;η χαρις του κυριου ιησου χριστου και η αγαπη του θεου και η κοινωνια του αγιου πνευματος μετα παντων υμων αμην [προς κορινθιους δευτερα εγραφη απο φιλιππων της μακεδονιας δια τιτου και λουκα]